{
  "$schema": "https://json-schema.org/draft/2020-12/schema",
  "$id": "https://github.com/Apps2Samsung/tizen-community-packages/packages.schema.json",
  "title": "Tizen Community Package manifest",
  "description": "One file per app under packages/. Compiled into repos-build.json / repos-sync.json by scripts/build-manifests.sh.",
  "type": "object",
  "additionalProperties": false,
  "required": ["name", "description", "category", "repo", "source"],
  "properties": {
    "name": { "type": "string", "minLength": 1, "pattern": "^[^|\n]+$", "description": "Display name shown in the README table. No '|' or newlines." },
    "description": { "type": "string", "minLength": 1, "pattern": "^[^|\n]+$", "description": "One-line description for the README table. No '|' or newlines." },
    "category": {
      "enum": ["media", "iptv", "streaming", "games", "casting", "tools", "other"],
      "description": "Catalog category, shown as a filter in Apps2Samsung. media = media-server clients and local players (Jellyfin, Plex, Kodi, music, photos, USB/DLNA); iptv = IPTV and live TV; streaming = clients for streaming services and sites (YouTube, Twitch, Kick, anime, Nuvio, Stremio); games = games, emulators and game streaming; casting = casting receivers and camera viewers; tools = browsers, loaders, network and system utilities; other = anything else."
    },
    "group": { "type": "string", "minLength": 1, "pattern": "^[^|\n]+$", "description": "Optional. Display name of the app this package is a variant of. Packages sharing a group fold into one Apps2Samsung entry with a variant picker (the Moonlight forks all set \"Moonlight\"). A package with several assets[] folds by itself: its group defaults to its name." },
    "variant": { "type": "string", "minLength": 1, "pattern": "^[^|\n]+$", "description": "Optional. Label for this package's file in the variant picker when it belongs to a group (e.g. \"OneLiberty · Chrome\"). Single-file packages only; with assets[] put variant on each asset. Defaults to the file name without extension." },
    "repo": {
      "type": "string",
      "pattern": "^[A-Za-z0-9_.-]+/[A-Za-z0-9_.-]+$",
      "description": "owner/repo on the forge named by host (GitHub by default). Used as the manifest key, the README link, and (for build/release) the API target."
    },
    "host": {
      "enum": ["github", "gitlab"],
      "default": "github",
      "description": "Forge that hosts repo. Defaults to github. gitlab (gitlab.com) is currently supported for source: build only."
    },
    "repo_label": { "type": "string", "minLength": 1, "pattern": "^[^|\n]+$", "description": "Optional link text for the README Repository column. Defaults to the repo owner." },
    "enabled": { "type": "boolean", "default": true, "description": "Set to false to retire the package without deleting this file: it is skipped by the sync (not built, downloaded, or shipped in the release) and left out of the README table. Absent means true." },
    "adult": { "type": "boolean", "default": false, "description": "Set to true for an app whose content is for adults only (18+): pornography or other sexually explicit material. The package ships like any other, but catalog.json carries adult: true on each of its files so Apps2Samsung hides it until the user turns on the 18+ toggle, and the README lists it in a collapsed section instead of the main table. Absent means false. Independent of category: an adult app still gets the category that says what it is (a media-server client, an IPTV player)." },
    "source": {
      "enum": ["build", "release", "direct"],
      "description": "build = compiled from source with Tizen Studio; release = prebuilt .wgt from GitHub Releases; direct = downloaded from a fixed URL."
    },
    "branch": { "type": "string", "minLength": 1, "description": "build/release only." },
    "project_path": { "type": "string", "description": "build only. Subdirectory containing the Tizen web project. Defaults to \".\"." },
    "skip_npm": { "type": "boolean", "description": "build only." },
    "pre_build": { "type": "string", "description": "build only. Shell command run before packaging." },
    "overlay": { "type": "string", "pattern": "^[A-Za-z0-9._-]+$", "description": "build only. Name of a directory under apps/ whose contents are copied over the project before packaging (e.g. a config.xml the upstream doesn't ship)." },
    "url": { "type": "string", "pattern": "^https?://", "description": "direct only. Absolute URL to the .wgt." },
    "output_name": { "type": "string", "pattern": "\\.(wgt|tpk)$", "description": "Filename inside the bundle. Required unless using assets[]." },
    "extract": { "type": "string", "minLength": 1, "description": "release/direct only. The downloaded asset is a zip wrapper; extract the entry matching this exact name or regex and use that as the package. Use when upstream ships the .wgt inside a .zip." },
    "assets": {
      "type": "array",
      "minItems": 1,
      "description": "release only. Use when one release contains multiple .wgt files.",
      "items": {
        "type": "object",
        "additionalProperties": false,
        "required": ["match", "output_name"],
        "properties": {
          "match": { "type": "string", "minLength": 1, "description": "Exact asset name or a regex matched against release asset names." },
          "variant": { "type": "string", "minLength": 1, "pattern": "^[^|\n]+$", "description": "Optional. Label for this file in the Apps2Samsung variant picker (e.g. \"Tizen 8\"). Defaults to output_name without extension." },
          "output_name": { "type": "string", "pattern": "\\.(wgt|tpk)$" },
          "extract": { "type": "string", "minLength": 1, "description": "This asset is a zip wrapper; extract the entry matching this exact name or regex." }
        }
      }
    },
    "flags": {
      "type": "array",
      "minItems": 1,
      "uniqueItems": true,
      "items": { "enum": ["root"] },
      "description": "Optional. Install-time properties Apps2Samsung warns about before installing. root = the package gains root on the TV and runs a service from boot; after install the user sets Developer Mode Host PC IP to 127.0.0.1 and restarts, which locks every PC (Apps2Samsung included) out of SDB until it is set back. Copied onto each of the package's files in catalog.json."
    },
    "user_settings": {
      "type": "object",
      "additionalProperties": false,
      "required": ["fields"],
      "description": "Optional. Values the user supplies before install (e.g. a per-user API key, a port). Apps2Samsung asks for them and writes them into the package before re-signing. Two forms, not mixed: file + find/replace on every field (one file), or targets on every field and no file (several files). Copied into catalog.json.",
      "properties": {
        "help_url": { "type": "string", "pattern": "^https://", "description": "Page that explains where to get the values. Shown as a link above the form." },
        "file": { "$ref": "#/$defs/package_path", "description": "Path of the file to patch, relative to the package root (for build, relative to project_path). Required when the fields use find/replace, absent when they use targets." },
        "fields": {
          "type": "array",
          "minItems": 1,
          "items": {
            "type": "object",
            "additionalProperties": false,
            "required": ["key", "label", "type"],
            "properties": {
              "key": { "type": "string", "pattern": "^[a-z][a-z0-9_]*$", "description": "Stable id; Apps2Samsung stores the value under it per app." },
              "label": { "type": "string", "minLength": 1, "description": "Field label in the form." },
              "type": { "enum": ["number", "text"], "description": "number = digits only, written as-is; text = written with quotes and backslashes escaped." },
              "required": { "type": "boolean", "default": true },
              "pattern": { "type": "string", "minLength": 1, "description": "Optional regex the value must match." },
              "default": { "type": "string", "minLength": 1, "description": "Optional. Written instead when the field is not required and the user leaves it empty, so every find is always replaced. Must itself pass the field's own checks." },
              "min": { "type": "integer", "description": "number only. Smallest accepted value, inclusive." },
              "max": { "type": "integer", "description": "number only. Largest accepted value, inclusive." },
              "disallow": { "type": "array", "minItems": 1, "uniqueItems": true, "items": { "type": "integer" }, "description": "number only. Values the form rejects (e.g. ports the TV itself uses)." },
              "find": { "type": "string", "minLength": 1, "description": "Exact text in file that is replaced. The install fails if it is missing." },
              "replace": { "$ref": "#/$defs/replace" },
              "targets": {
                "type": "array",
                "minItems": 1,
                "description": "Every place the value goes, when it lands in more than one spot or file. All are applied; the install fails if any find is missing. Used instead of file + find/replace.",
                "items": {
                  "type": "object",
                  "additionalProperties": false,
                  "required": ["file", "find", "replace"],
                  "properties": {
                    "file": { "$ref": "#/$defs/package_path" },
                    "find": { "type": "string", "minLength": 1, "description": "Exact text in file that is replaced." },
                    "replace": { "$ref": "#/$defs/replace" }
                  }
                }
              }
            },
            "if": { "properties": { "type": { "const": "text" } } },
            "then": { "not": { "anyOf": [ { "required": ["min"] }, { "required": ["max"] }, { "required": ["disallow"] } ] } }
          }
        }
      },
      "oneOf": [
        {
          "required": ["file"],
          "properties": { "fields": { "items": { "required": ["find", "replace"], "not": { "required": ["targets"] } } } }
        },
        {
          "not": { "required": ["file"] },
          "properties": { "fields": { "items": { "required": ["targets"], "not": { "anyOf": [ { "required": ["find"] }, { "required": ["replace"] } ] } } } }
        }
      ]
    }
  },
  "$defs": {
    "package_path": { "type": "string", "pattern": "^[A-Za-z0-9_./-]+$", "not": { "pattern": "(^/|\\.\\.)" }, "description": "Path inside the package, relative to its root (for build, relative to project_path). No leading / and no .." },
    "replace": { "type": "string", "pattern": "\\{value\\}", "description": "Replacement text; {value} is the user's value." }
  },
  "allOf": [
    {
      "if": { "required": ["assets"] },
      "then": { "not": { "required": ["variant"] } }
    },
    {
      "if": { "required": ["source"], "properties": { "source": { "const": "build" } } },
      "then": {
        "required": ["branch", "output_name"],
        "not": { "anyOf": [ { "required": ["url"] }, { "required": ["assets"] }, { "required": ["extract"] } ] }
      }
    },
    {
      "if": { "required": ["source"], "properties": { "source": { "const": "release" } } },
      "then": {
        "required": ["branch"],
        "not": { "anyOf": [ { "required": ["url"] }, { "required": ["skip_npm"] }, { "required": ["pre_build"] }, { "required": ["project_path"] }, { "required": ["overlay"] }, { "required": ["host"] } ] },
        "oneOf": [
          { "required": ["output_name"], "not": { "required": ["assets"] } },
          { "required": ["assets"], "not": { "anyOf": [ { "required": ["output_name"] }, { "required": ["extract"] } ] } }
        ]
      }
    },
    {
      "if": { "required": ["source"], "properties": { "source": { "const": "direct" } } },
      "then": {
        "required": ["url", "output_name"],
        "not": { "anyOf": [ { "required": ["branch"] }, { "required": ["assets"] }, { "required": ["skip_npm"] }, { "required": ["pre_build"] }, { "required": ["project_path"] }, { "required": ["overlay"] }, { "required": ["host"] } ] }
      }
    }
  ]
}
