{
  "name": "StashZen",
  "description": "A Stash client for Samsung Tizen TVs to manage private media from a Stash server.",
  "category": "media",
  "repo": "Stashified/StashZen",
  "source": "release",
  "branch": "main",
  "assets": [
    { "match": "StashZen-.*[.]wgt$", "output_name": "StashZen.wgt" }
  ]
}
