
{
  "name": "Moonlight Tizen (AC-3)",
  "description": "Open-source Moonlight client for Tizen OS with optional support for Dolby Digital and Dolby Digital Plus (stereo and 5.1) optical-audio and HDMI passthrough.",
  "category": "games",
  "group": "Moonlight",
  "repo": "fidoboy/moonlight-tizen-ac3",
  "repo_label": "fidoboy",
  "source": "release",
  "branch": "master",
  "assets": [
    {
      "match": "Moonlight.wgt",
      "variant": "fidoboy · Dolby",
      "output_name": "Moonlight-AC3-fidoboy.wgt"
    },
    {
      "match": "Moonlight-ForceGM.wgt",
      "variant": "fidoboy · Dolby ForceGM",
      "output_name": "Moonlight-AC3-fidoboy-ForceGM.wgt"
    }
  ]
}
