{
  "name": "Kick TV 2.0",
  "description": "Kick live streams and public archives for Samsung Tizen TVs.",
  "category": "streaming",
  "repo": "janrydzewski/kick-tv-2.0",
  "source": "release",
  "branch": "main",
  "assets": [
    { "match": "^KickTV20[.]wgt$", "output_name": "KickTV20.wgt" }
  ]
}
