{
  "name": "Chorus2-Tizen",
  "description": "Chorus2-Tizen (Kodi) Samsung Tizen.",
  "category": "media",
  "group": "Kodi",
  "repo": "PatrickSt1991/chorus2-tizen",
  "repo_label": "Chorus2-Tizen",
  "source": "release",
  "branch": "release",
  "assets": [
    { "match": "^Chorus2-Tizen[.]wgt$", "variant": "Chorus2 web UI", "output_name": "Kodi-Chorus.wgt" }
  ]
}
